"Our Father, who art in heaven,"   ,"congregation","hangingIndent",
"hallowed be thy Name,"            ,"congregation","indent"
"thy kingdom come,"                ,"congregation","indent"
"thy will be done,"                ,"congregation","indent"
"on earth as it is in heaven."     ,"congregation","indent"       ,
"Give us this day our daily bread.","congregation","hangingIndent",,
"And forgive us our trespasses,"   ,"congregation","hangingIndent",
"as we forgive those"              ,"congregation","indent"
"who trespass against us."         ,"congregation","indent"       ,
"And lead us not into temptation," ,"congregation","hangingIndent",
"but deliver us from evil."        ,"congregation","indent"       ,
"For thine is the kingdom,"        ,"congregation","hangingIndent",
"and the power, and the glory,"    ,"congregation","indent"
"for ever and ever. Amen."         ,"congregation","indent"
