"Splendor and honor and kingly power *", "congregation",
"are yours by right, O Lord our God,", "congregation", true,
"For you created everything that is, *", "congregation",
"and by your will they were created and have their being; ", "congregation", true,
"And yours by right, O Lamb that was slain, *", "congregation",
"for with your blood you have redeemed for God, ", "congregation", true,
"From every family, language, people, and nation, *", "congregation",
"a kingdom of priests to serve our God. ", "congregation", true,
"And so, to him who sits upon the throne, *", "congregation",
"and to Christ the Lamb,", "congregation", true,
"Be worship and praise, dominion and splendor, *", "congregation",
"for ever and for evermore. Amen.", "congregation", true,
