"O sing unto the LORD a new song, *", "congregation",
"for he has done marvelous things.</strong></p>", "congregation", "true",
"With his own right hand, and with his holy arm, *", "congregation",
"he has won for himself the victory.</strong></p>", "congregation", "true",
"The LORD declared his salvation; *", "congregation",
"his righteousness he has openly shown in the sight of the nations.</strong></p>", "congregation", "true",
"He has remembered his mercy and truth toward the house of Israel,*", "congregation",
"and all the ends of the world have seen the salvation of our God.</strong></p>", "congregation", "true",
"Show yourselves joyful unto the LORD, all you lands; *", "congregation",
"sing, rejoice, and give thanks.</strong></p>", "congregation", "true",
"Praise the LORD with the harp; *", "congregation",
"sing with the harp a psalm of thanksgiving.</strong></p>", "congregation", "true",
"With trumpets also and horns, *", "congregation",
"O show yourselves joyful before the LORD, the King. </strong></p>", "congregation", "true",
"Let the sea make a noise, and all that is in it, *", "congregation",
"the round world, and those that dwell therein.</strong></p>", "congregation", "true",
"Let the rivers clap their hands, and let the hills be joyful together before the LORD, *", "congregation",
"for he has come to judge the earth.</strong></p>", "congregation", "true",
"With righteousness shall he judge the world *", "congregation",
"and the peoples with equity.", "congregation", true
